{
  "schema_version": "0.2.0",
  "assessment_id": "gov_gen04_001",
  "generation": 4,
  "created_at": "2026-08-17T01:45:00Z",
  "metrics": {
    "context_pressure": 0.8,
    "error_density": 0.6,
    "loop_probability": 0.7,
    "goal_drift": 0.3
  },
  "weights": {
    "context_pressure": 0.35,
    "error_density": 0.25,
    "loop_probability": 0.25,
    "goal_drift": 0.15
  },
  "thresholds": {
    "prepare": 0.4,
    "handoff": 0.6,
    "emergency": 0.8
  },
  "anomaly_override": {
    "detected": false,
    "reasons": []
  },
  "handoff_score": 0.65,
  "decision": "HANDOFF"
}
